<?xml version="1.0"?>
<transfers xmlns="spryker:transfer-01"
    xmlns:xsi="http://www.w3.org/2001/XMLSchema-instance"
    xsi:schemaLocation="spryker:transfer-01 http://static.spryker.com/transfer-01.xsd">

    <transfer name="ProductOption">
        <property name="idSalesOrderItemOption" type="int" />
        <property name="idOptionValueUsage" type="int" />
        <property name="localeCode" type="string " />
        <property name="labelOptionType" type="string" />
        <property name="labelOptionValue" type="string" />
        <property name="taxRate" type="float" />
        <property name="calculatedDiscounts" type="CalculatedDiscount[]" singular="calculatedDiscount" />
        <property name="unitGrossPrice" type="int" />
        <property name="sumGrossPrice" type="int" />
        <property name="quantity" type="int" />
        <property name="refundableAmount" type="int"/>
        <property name="unitTaxAmount" type="int" />
        <property name="sumTaxAmount" type="int" />
    </transfer>

    <transfer name="ProductOptionsNameValue">
        <property name="type" type="string" />
        <property name="value" type="string" />
    </transfer>

    <transfer name="Item">
        <property name="idProductAbstract" type="int" />
        <property name="IdSalesOrderItem" type="int" />
        <property name="name" type="string" />
        <property name="unitGrossPrice" type="int" />
        <property name="quantity" type="int" />
        <property name="sumGrossPrice" type="int" />
        <property name="taxRate" type="float" />
        <property name="sku" type="string" />
        <property name="productOptions" type="ProductOption[]" singular="productOption" />
        <property name="unitGrossPriceWithProductOptions" type="int" />
        <property name="sumGrossPriceWithProductOptions" type="int" />
        <property name="refundableAmount" type="int"/>
        <property name="canceledAmount" type="int"/>
    </transfer>

    <transfer name="Quote">
        <property name="items" type="Item[]" singular="item"/>
        <property name="totals" type="Totals" />
        <property name="shippingAddress" type="Address"/>
    </transfer>

    <transfer name="Order">
        <property name="items" type="Item[]" singular="item"/>
        <property name="totals" type="Totals" />
        <property name="shippingAddress" type="Address"/>
    </transfer>

    <transfer name="Address">
        <property name="iso2Code" type="string" />
    </transfer>

    <transfer name="TaxTotal">
        <property name="amount" type="int" />
    </transfer>

    <transfer name="CheckoutResponse">
        <property name="isSuccess" type="bool" />
        <property name="errors" type="CheckoutError[]" singular="error" />
        <property name="isExternalRedirect" type="bool" />
        <property name="redirectUrl" type="string" />
        <property name="saveOrder" type="SaveOrder" />
    </transfer>

    <transfer name="SaveOrder">
        <property name="idSalesOrder" type="int" />
        <property name="orderItems" type="Item[]" singular="orderItem"/>
    </transfer>

</transfers>
