<?xml version="1.0"?>
<transfers xmlns="spryker:transfer-01"
    xmlns:xsi="http://www.w3.org/2001/XMLSchema-instance"
    xsi:schemaLocation="spryker:transfer-01 http://static.spryker.com/transfer-01.xsd">

    <transfer name="QuickOrder">
        <property name="items" type="QuickOrderItem[]"/>
    </transfer>

    <transfer name="QuickOrderItem">
        <property name="sku" type="string"/>
        <property name="productConcrete" type="ProductConcrete"/>
        <property name="quantity" type="int"/>
    </transfer>

    <transfer name="ProductConcrete">
        <property name="sku" type="string"/>
        <property name="idProductConcrete" type="int"/>
        <property name="fkProductAbstract" type="int"/>
    </transfer>

    <transfer name="Item">
        <property name="sku" type="string"/>
        <property name="id" type="int"/>
        <property name="idProductAbstract" type="int"/>
        <property name="quantity" type="int"/>
    </transfer>

    <transfer name="ItemValidation">
        <property name="item" type="Item"/>
        <property name="messages" type="Message[]" singular="Message"/>
        <property name="suggestedValues" type="Item"/>
    </transfer>

    <transfer name="Message">
        <property name="type" type="string"/>
        <property name="value" type="string"/>
        <property name="parameters" type="array"/>
    </transfer>
</transfers>
