<?xml version="1.0"?>
<transfers xmlns="spryker:transfer-01"
    xmlns:xsi="http://www.w3.org/2001/XMLSchema-instance"
    xsi:schemaLocation="spryker:transfer-01 http://static.spryker.com/transfer-01.xsd">

    <transfer name="DataImporterConfiguration">
        <property name="importType" type="string" />
        <property name="readerConfiguration" type="DataImporterReaderConfiguration" />
        <property name="throwException" type="bool" />
    </transfer>

    <transfer name="DataImporterReaderConfiguration">
        <property name="fileName" type="string" />
        <property name="fileEncoding" type="string" />
        <property name="directories" type="array" singular="directory" />
        <property name="offset" type="int" />
        <property name="limit" type="int" />
        <property name="csvDelimiter" type="string" />
        <property name="csvEnclosure" type="string" />
        <property name="csvEscape" type="string" />
        <property name="csvFlags" type="int" />
        <property name="csvHasHeader" type="bool" />
    </transfer>

    <transfer name="DataImporterReport">
        <property name="importType" type="string" />
        <property name="importTime" type="float" />
        <property name="importedDataSetCount" type="int" />
        <property name="expectedImportableDataSetCount" type="int" />
        <property name="isReaderCountable" type="bool" />
        <property name="isSuccess" type="bool" />
        <property name="dataImporterReports" type="DataImporterReport[]" singular="dataImporterReport" />
    </transfer>

</transfers>

