<?xml version="1.0"?>
<transfers xmlns="spryker:transfer-01"
    xmlns:xsi="http://www.w3.org/2001/XMLSchema-instance"
    xsi:schemaLocation="spryker:transfer-01 http://static.spryker.com/transfer-01.xsd">

    <transfer name="ProductReview">
        <property name="idProductReview" type="int"/>
        <property name="fkProductAbstract" type="int"/>
        <property name="fkLocale" type="int"/>
        <property name="customerReference" type="string"/>
        <property name="rating" type="int"/>
        <property name="summary" type="string"/>
        <property name="description" type="string"/>
        <property name="nickname" type="string"/>
        <property name="status" type="int"/>
        <property name="createdAt" type="string"/>
        <property name="updatedAt" type="string"/>
    </transfer>

    <transfer name="ProductReviewRequest">
        <property name="idProductAbstract" type="int"/>
        <property name="localeName" type="string"/>
        <property name="customerReference" type="string"/>
        <property name="rating" type="int"/>
        <property name="summary" type="string"/>
        <property name="description" type="string"/>
        <property name="nickname" type="string"/>
    </transfer>

    <transfer name="ProductReviewError">
        <property name="message" type="string"/>
    </transfer>

    <transfer name="ProductReviewResponse">
        <property name="productReview" type="ProductReview"/>
        <property name="isSuccess" type="bool"/>
        <property name="errors" type="ProductReviewError[]" singular="error"/>
    </transfer>

    <transfer name="ProductReviewSearchConfig">
        <property name="paginationConfig" type="PaginationConfig"/>
    </transfer>

    <transfer name="ProductReviewSearchRequest">
        <property name="idProductAbstract" type="int"/>
        <property name="requestParams" type="array"/>
    </transfer>

    <transfer name="ProductAbstractReview">
        <property name="idProductAbstract" type="int"/>
        <property name="averageRating" type="float"/>
        <property name="reviewCount" type="int"/>
    </transfer>

</transfers>

