<?xml version="1.0"?>
<transfers xmlns="spryker:transfer-01"
    xmlns:xsi="http://www.w3.org/2001/XMLSchema-instance"
    xsi:schemaLocation="spryker:transfer-01 http://static.spryker.com/transfer-01.xsd">

    <transfer name="ProductAbstractDataFeed">
        <property name="joinPrice" type="bool"/>
        <property name="joinCategory" type="bool"/>
        <property name="joinImage" type="bool"/>
        <property name="joinProduct" type="bool"/>
        <property name="joinOption" type="bool"/>
        <property name="useOnlyActiveStock" type="bool"/>
        <property name="updatedFrom" type="string"/>
        <property name="updatedTo" type="string"/>
        <property name="idLocale" type="int"/>
    </transfer>

</transfers>
