<?xml version="1.0"?>
<transfers xmlns="spryker:transfer-01"
           xmlns:xsi="http://www.w3.org/2001/XMLSchema-instance"
           xsi:schemaLocation="spryker:transfer-01 http://static.spryker.com/transfer-01.xsd">

    <transfer name="ProductOptionValueStorage">
        <property name="idProductOptionValue" type="int"/>
        <property name="sku" type="string"/>
        <property name="price" type="int"/>
        <property name="prices" type="array" singular="prices"/>
        <property name="value" type="string"/>
    </transfer>

    <transfer name="ProductOptionGroupStorage">
        <property name="name" type="string"/>
        <property name="productOptionValues" singular="productOptionValue" type="ProductOptionValueStorage[]"/>
    </transfer>

    <transfer name="ProductAbstractOptionStorage">
        <property name="idProductAbstract" type="int"/>
        <property name="productOptionGroups" singular="productOptionGroup" type="ProductOptionGroupStorage[]"/>
    </transfer>

    <transfer name="ProductAbstractOptionGroupStatus">
        <property name="idProductAbstract" type="int"/>
        <property name="isActive" type="bool"/>
        <property name="productOptionGroupName" type="string"/>
    </transfer>

    <transfer name="Currency">
        <property name="code" type="string"/>
    </transfer>

    <transfer name="StorageProductOptionGroupCollection">
        <property name="productOptionGroups" type="StorageProductOptionGroup[]" singular="productOptionGroup"/>
    </transfer>

    <transfer name="SynchronizationData">
        <property name="store" type="string"/>
        <property name="reference" type="string"/>
    </transfer>

    <transfer name="Store">
        <property name="idStore" type="int"/>
        <property name="name" type="string"/>
    </transfer>

    <transfer name="ProductOptionValueStorePricesRequest">
        <property name="prices" type="MoneyValue[]" singular="price"/>
    </transfer>

    <transfer name="ProductOptionValueStorePricesResponse">
        <property name="storePrices" type="array" singular="storePrices"/>
    </transfer>

    <transfer name="MoneyValue">
        <property name="netAmount" type="int"/>
        <property name="grossAmount" type="int"/>
    </transfer>

    <transfer name="StorageProductOptionGroup">
    </transfer>

</transfers>
