<?xml version="1.0"?>
<transfers xmlns="spryker:transfer-01"
   xmlns:xsi="http://www.w3.org/2001/XMLSchema-instance"
   xsi:schemaLocation="spryker:transfer-01 http://static.spryker.com/transfer-01.xsd">

    <transfer name="QuoteResponse">
        <property name="isSuccessful" type="bool"/>
    </transfer>

    <transfer name="Currency">
        <property name="code" type="string"/>
    </transfer>

    <transfer name="Quote">
        <property name="currency" type="Currency"/>
        <property name="items" type="Item[]" singular="item"/>
    </transfer>

</transfers>
