<?xml version="1.0"?>
<transfers xmlns="spryker:transfer-01" xmlns:xsi="http://www.w3.org/2001/XMLSchema-instance" xsi:schemaLocation="spryker:transfer-01 http://static.spryker.com/transfer-01.xsd">

    <transfer name="Locale">
    </transfer>

    <transfer name="PageMap">
    </transfer>

    <transfer name="ProductPageLoad">
        <property name="productAbstractIds" type="array" singular="productAbstractIds"/>
        <property name="payloadTransfers" type="array" singular="payloadTransfers"/>
    </transfer>

    <transfer name="ProductPageSearch">
        <property name="labelIds" type="array" singular="labelIds"/>
        <property name="store" type="string"/>
    </transfer>

    <transfer name="ProductPayload">
        <property name="labelIds" type="array" singular="labelIds"/>
        <property name="idProductAbstract" type="int"/>
    </transfer>

    <transfer name="ProductLabel">
        <property name="storeRelation" type="StoreRelation"/>
        <property name="productLabelProductAbstracts" type="ProductLabelProductAbstract[]" singular="productLabelProductAbstract"/>
        <property name="idProductLabel" type="int"/>
        <property name="isExclusive" type="bool"/>
        <property name="position" type="int"/>
    </transfer>

    <transfer name="ProductLabelCriteria">
        <property name="productLabelConditions" type="ProductLabelConditions" strict="true"/>
        <property name="productAbstractIds" type="int[]" singular="productAbstractId" deprecated="Use ProductLabelConditions.productAbstractIds instead."/>
        <property name="pagination" type="Pagination" strict="true"/>
        <property name="sortCollection" type="Sort[]" singular="sort" strict="true"/>
        <property name="withProductLabelStores" type="bool"/>
        <property name="withProductLabelProductAbstracts" type="bool"/>
    </transfer>

    <transfer name="ProductLabelProductAbstract">
    </transfer>

    <transfer name="Store">
        <property name="name" type="string"/>
    </transfer>

    <transfer name="StoreRelation">
        <property name="stores" type="Store[]" singular="stores"/>
    </transfer>

    <transfer name="ProductLabelCollection" strict="true">
        <property name="productLabels" type="ProductLabel[]" singular="productLabel"/>
    </transfer>

    <transfer name="Pagination">
        <property name="offset" type="int"/>
        <property name="limit" type="int"/>
    </transfer>

    <transfer name="Sort">
        <property name="field" type="string"/>
        <property name="isAscending" type="bool"/>
    </transfer>

    <transfer name="ProductLabelConditions" strict="true">
        <property name="productAbstractIds" type="int[]" singular="productAbstractId"/>
        <property name="isActive" type="bool"/>
    </transfer>

    <transfer name="HydrateEventsRequest">
        <property name="eventEntities" type="EventEntity[]" singular="eventEntity" description="Collection of event entities to be processed"/>
        <property name="foreignKeyName" type="string" description="Name of the foreign key field used for grouping or identification"/>
    </transfer>

    <transfer name="HydrateEventsResponse">
        <property name="idTimestampMap" type="array" associative="true" singular="id" description="Map of event entity IDs to their corresponding timestamps"/>
        <property name="foreignKeyTimestampMap" type="array" associative="true" singular="foreignKey" description="Map of foreign key values to their corresponding timestamps"/>
    </transfer>

    <transfer name="EventEntity">
    </transfer>

</transfers>
