<?xml version="1.0"?>
<transfers xmlns="spryker:transfer-01" xmlns:xsi="http://www.w3.org/2001/XMLSchema-instance" xsi:schemaLocation="spryker:transfer-01
    http://static.spryker.com/transfer-01.xsd">

    <transfer name="AppConfigUpdated" strict="true">
        <property name="status" type="string" description="The Status of an App that enabled (NEW) or disabled (CONNECTED)"/>
        <property name="isActive" type="bool"/>
        <property name="config" type="array" singular="config"/>
        <property name="appIdentifier" type="string" description="The identifier of an App"/>
        <property name="messageChannels" type="array" singular="messageChannel" description="The message channels that are used by an App"/>
        <property name="messageAttributes" type="MessageAttributes"/>
    </transfer>

    <transfer name="AppConfig" strict="true">
        <property name="appIdentifier" type="string" description="The identifier of an App"/>
        <property name="messageChannels" type="array" singular="messageChannel" description="The message channels that are used by an App"/>
        <property name="status" type="string"/>
        <property name="isActive" type="bool"/>
        <property name="config" type="array" singular="config"/>
    </transfer>

    <transfer name="AcpHttpRequest" strict="true">
        <property name="method" type="string"/>
        <property name="uri" type="string"/>
        <property name="headers" type="array" associative="true" singular="header"/>
        <property name="query" type="array" associative="true" singular="param"/>
        <property name="body" type="string"/>
    </transfer>

    <transfer name="AcpHttpResponse" strict="true">
        <property name="httpStatusCode" type="int"/>
        <property name="content" type="string"/>
    </transfer>

    <transfer name="MessageAttributes">
    </transfer>

</transfers>
