<?xml version="1.0"?>
<transfers xmlns="spryker:transfer-01"
           xmlns:xsi="http://www.w3.org/2001/XMLSchema-instance"
           xsi:schemaLocation="spryker:transfer-01 http://static.spryker.com/transfer-01.xsd">

    <transfer name="ContentProductAbstractListRestAttributes">
        <property name="abstractProducts" type="AbstractProductsRestAttributes[]"/>
    </transfer>

    <transfer name="AbstractProductsRestAttributes">
        <property name="sku" type="string"/>
    </transfer>

    <transfer name="ExecutedContentStorage">
        <property name="idContent" type="int" />
        <property name="type" type="string" />
        <property name="content" type="array" />
    </transfer>

    <transfer name="RestErrorMessage">
        <property name="status" type="int" />
        <property name="code" type="string" />
        <property name="detail" type="string" />
    </transfer>

</transfers>
