<?xml version="1.0"?>
<transfers xmlns="spryker:transfer-01"
    xmlns:xsi="http://www.w3.org/2001/XMLSchema-instance"
    xsi:schemaLocation="spryker:transfer-01 http://static.spryker.com/transfer-01.xsd">

    <transfer name="Country">
        <property name="idCountry" type="int" />
        <property name="iso2Code" type="string" />
        <property name="iso3Code" type="string" />
        <property name="name" type="string" />
        <property name="postalCodeMandatory" type="bool" />
        <property name="postalCodeRegex" type="string" />
    </transfer>

    <transfer name="CountryCollection">
        <property name="countries" type="Country[]" />
    </transfer>

</transfers>

