<?xml version="1.0"?>
<transfers xmlns="spryker:transfer-01"
           xmlns:xsi="http://www.w3.org/2001/XMLSchema-instance"
           xsi:schemaLocation="spryker:transfer-01 http://static.spryker.com/transfer-01.xsd">

    <transfer name="PriceProductFilter">
        <property name="quantity" type="int"/>
    </transfer>

    <transfer name="PriceProduct">
        <property name="volumeQuantity" type="int"/>
        <property name="groupKey" type="string"/>
        <property name="isMergeable" type="bool"/>
        <property name="moneyValue" type="MoneyValue"/>
    </transfer>

    <transfer name="MoneyValue">
        <property name="priceData" type="string"/>
        <property name="grossAmount" type="int"/>
        <property name="netAmount" type="int"/>
    </transfer>

</transfers>
