<?xml version="1.0"?>
<transfers xmlns="spryker:transfer-01"
   xmlns:xsi="http://www.w3.org/2001/XMLSchema-instance"
   xsi:schemaLocation="spryker:transfer-01 http://static.spryker.com/transfer-01.xsd">

    <transfer name="Navigation">
        <property name="idNavigation" type="int"/>
        <property name="key" type="string"/>
        <property name="name" type="string"/>
        <property name="isActive" type="bool"/>
    </transfer>

    <transfer name="DuplicateNavigation">
        <property name="idBaseNavigation" type="int"/>
        <property name="key" type="string"/>
        <property name="name" type="string"/>
    </transfer>

    <transfer name="NavigationResponse">
        <property name="isSuccessful" type="bool"/>
        <property name="navigation" type="Navigation"/>
        <property name="errors" type="NavigationError[]" singular="error"/>
    </transfer>

    <transfer name="NavigationError">
        <property name="message" type="string"/>
    </transfer>

    <transfer name="NavigationNode">
        <property name="fkNavigation" type="int"/>
        <property name="fkParentNavigationNode" type="int"/>
        <property name="navigationNodeLocalizedAttributes" type="NavigationNodeLocalizedAttributes[]" singular="navigationNodeLocalizedAttribute"/>
        <property name="idNavigationNode" type="int"/>
        <property name="nodeType" type="string"/>
    </transfer>

    <transfer name="NavigationTree">
    </transfer>

    <transfer name="Url">
        <property name="url" type="string"/>
        <property name="fkLocale" type="int"/>
        <property name="fkResourceCategorynode" type="int"/>
        <property name="fkResourcePage" type="int"/>
        <property name="idUrl" type="int"/>
    </transfer>

    <transfer name="NavigationNodeLocalizedAttributes">
        <property name="fkLocale" type="int"/>
        <property name="fkUrl" type="int"/>
        <property name="cmsPageUrl" type="string"/>
        <property name="categoryUrl" type="string"/>
    </transfer>

    <transfer name="Locale">
        <property name="idLocale" type="int"/>
    </transfer>

    <transfer name="NavigationCriteria">
        <property name="idNavigation" type="int"/>
    </transfer>

</transfers>
